{
  "asset": {
    "copyright": "Model by Fabio Pellacini from github.com/~xelatihy/yocto-gl",
    "generator": "Yocto/GL - https://github.com/xelatihy/yocto-gl",
    "version": "4.2"
  },
  "cameras": [
    {
      "name": "default",
      "frame": [
        0.8151804208755493,
        -0.0,
        0.579207181930542,
        0.16660168766975403,
        0.9577393531799316,
        -0.23447643220424652,
        -0.5547295212745667,
        0.28763750195503235,
        0.7807304263114929,
        -0.75,
        0.4000000059604645,
        0.8999999761581421
      ],
      "aspect": 2.4000000953674316,
      "focus": 1.2168092727661133
    }
  ],
  "environments": [
    {
      "name": "sky",
      "emission": [
        0.5,
        0.5,
        0.5
      ],
      "emission_tex": 0
    }
  ],
  "textures": [
    {
      "name": "sky",
      "uri": "textures/sky.hdr"
    },
    {
      "name": "floor",
      "uri": "textures/floor.png"
    },
    {
      "name": "uvgrid",
      "uri": "textures/uvgrid.png"
    }
  ],
  "shapes": [
    {
      "name": "arealight1",
      "uri": "shapes/arealight1.ply"
    },
    {
      "name": "arealight2",
      "uri": "shapes/arealight2.ply"
    },
    {
      "name": "floor",
      "uri": "shapes/floor.ply"
    },
    {
      "name": "sphere",
      "uri": "shapes/sphere.ply"
    },
    {
      "name": "flipcapuvsphere",
      "uri": "shapes/flipcapuvsphere.ply"
    },
    {
      "name": "disk",
      "uri": "shapes/disk.ply"
    },
    {
      "name": "uvcylinder",
      "uri": "shapes/uvcylinder.ply"
    },
    {
      "name": "cube",
      "uri": "shapes/cube.ply"
    }
  ],
  "subdivs": [],
  "materials": [
    {
      "name": "arealight1",
      "type": "matte",
      "emission": [
        20,
        20,
        20
      ],
      "color": [
        0,
        0,
        0
      ]
    },
    {
      "name": "arealight2",
      "type": "matte",
      "emission": [
        20,
        20,
        20
      ],
      "color": [
        0,
        0,
        0
      ]
    },
    {
      "name": "floor",
      "type": "matte",
      "color": [
        1,
        1,
        1
      ],
      "color_tex": 1
    },
    {
      "name": "uvgrid",
      "type": "glossy",
      "color": [
        1,
        1,
        1
      ],
      "roughness": 0.2,
      "color_tex": 2
    }
  ],
  "instances": [
    {
      "name": "arealight1",
      "frame": [
        0.8944271802902222,
        -0.0,
        0.4472135901451111,
        0.27562475204467773,
        0.7874992489814758,
        -0.5512495040893555,
        -0.3521803617477417,
        0.6163156628608704,
        0.7043607234954834,
        -0.4000000059604645,
        0.800000011920929,
        0.800000011920929
      ],
      "shape": 0,
      "material": 0
    },
    {
      "name": "arealight2",
      "frame": [
        0.8944271802902222,
        0.0,
        -0.4472135901451111,
        -0.27562475204467773,
        0.7874992489814758,
        -0.5512495040893555,
        0.3521803617477417,
        0.6163156628608704,
        0.7043607234954834,
        0.4000000059604645,
        0.800000011920929,
        0.800000011920929
      ],
      "shape": 1,
      "material": 1
    },
    {
      "name": "floor",
      "frame": [
        1,
        0,
        0,
        0,
        1,
        0,
        0,
        0,
        1,
        0,
        0,
        0
      ],
      "shape": 2,
      "material": 2
    },
    {
      "name": "sphere-uvgrid",
      "frame": [
        1,
        0,
        0,
        0,
        1,
        0,
        0,
        0,
        1,
        -0.4,
        0,
        0
      ],
      "shape": 3,
      "material": 3
    },
    {
      "name": "flipcapuvsphere-uvgrid",
      "frame": [
        1,
        0,
        0,
        0,
        1,
        0,
        0,
        0,
        1,
        -0.2,
        0,
        0
      ],
      "shape": 4,
      "material": 3
    },
    {
      "name": "disk-uvgrid",
      "frame": [
        1,
        0,
        0,
        0,
        1,
        0,
        0,
        0,
        1,
        0.0,
        0,
        0
      ],
      "shape": 5,
      "material": 3
    },
    {
      "name": "uvcylinder-uvgrid",
      "frame": [
        1,
        0,
        0,
        0,
        1,
        0,
        0,
        0,
        1,
        0.2,
        0,
        0
      ],
      "shape": 6,
      "material": 3
    },
    {
      "name": "cube-uvgrid",
      "frame": [
        1,
        0,
        0,
        0,
        1,
        0,
        0,
        0,
        1,
        0.4,
        0,
        0
      ],
      "shape": 7,
      "material": 3
    }
  ]
}