{
  "asset": {
    "copyright": "Model by Fabio Pellacini from github.com/~xelatihy/yocto-gl",
    "generator": "Yocto/GL - https://github.com/xelatihy/yocto-gl",
    "version": "4.2"
  },
  "cameras": [
    {
      "name": "default",
      "frame": [
        0.9805806875228882, -0.0, 0.1961161345243454, 0.08506310731172562,
        0.9010388255119324, -0.4253155291080475, -0.17670825123786926,
        0.43373844027519226, 0.8835412859916687, -0.6000000238418579, 1.5, 2.75
      ],
      "lens": 0.10000000149011612,
      "aspect": 2.4000000953674316,
      "focus": 3.1124749183654785
    },
    {
      "name": "front",
      "frame": [
        1.0, 0.0, 0.0, 0.0, 0.8853979110717773, -0.46483391523361206, 0.0,
        0.46483391523361206, 0.8853979110717773, 0.0, 1.75, 3.0
      ],
      "lens": 0.10000000149011612,
      "aspect": 3.0,
      "focus": 3.3883070945739746
    },
    {
      "name": "back",
      "frame": [
        -1.0, 0.0, 0.0, 0.0, 0.9026037454605103, 0.4304725229740143, 0.0,
        0.4304724931716919, -0.9026036858558655, 0.0, 1.5, -3.25
      ],
      "lens": 0.10000000149011612,
      "aspect": 3.0,
      "focus": 3.600694417953491
    },
    {
      "name": "perspective-sharp",
      "frame": [
        0.9805806875228882, -0.0, 0.1961161345243454, 0.08506310731172562,
        0.9010388255119324, -0.4253155291080475, -0.17670825123786926,
        0.43373844027519226, 0.8835412859916687, -0.6000000238418579, 1.5, 2.75
      ],
      "lens": 0.10000000149011612,
      "aspect": 2.4000000953674316,
      "focus": 3.1124749183654785
    },
    {
      "name": "perspective-dof",
      "frame": [
        0.9805806875228882, -0.0, 0.1961161345243454, 0.08506310731172562,
        0.9010388255119324, -0.4253155291080475, -0.17670825123786926,
        0.43373844027519226, 0.8835412859916687, -0.6000000238418579, 1.5, 2.75
      ],
      "lens": 0.10000000149011612,
      "aspect": 2.4000000953674316,
      "focus": 3.1124749183654785,
      "aperture": 0.05000000074505806
    },
    {
      "name": "orthographic-sharp",
      "frame": [
        0.9756097197532654, -0.0, 0.2195121943950653, 0.08407647162675858,
        0.9237421154975891, -0.3736732006072998, -0.20277264714241028,
        0.3830150067806244, 0.9012117385864258, -0.5, 1.0, 2.0
      ],
      "orthographic": true,
      "lens": 0.029999999329447746,
      "aspect": 2.4000000953674316,
      "focus": 2.2192342281341553
    },
    {
      "name": "orthographic-dof",
      "frame": [
        0.9756097197532654, -0.0, 0.2195121943950653, 0.08407647162675858,
        0.9237421154975891, -0.3736732006072998, -0.20277264714241028,
        0.3830150067806244, 0.9012117385864258, -0.5, 1.0, 2.0
      ],
      "orthographic": true,
      "lens": 0.029999999329447746,
      "aspect": 2.4000000953674316,
      "focus": 2.2192342281341553,
      "aperture": 0.019999999552965164
    }
  ],
  "environments": [
    {
      "name": "sky",
      "emission": [0.5, 0.5, 0.5],
      "emission_tex": 0
    }
  ],
  "textures": [
    {
      "name": "sky",
      "uri": "textures/sky.hdr"
    },
    {
      "name": "floor",
      "uri": "textures/floor.png"
    }
  ],
  "materials": [
    {
      "name": "floor",
      "color": [0.699999988079071, 0.699999988079071, 0.699999988079071],
      "color_tex": 1
    },
    {
      "name": "largearealight1",
      "emission": [10.0, 10.0, 10.0]
    },
    {
      "name": "largearealight2",
      "emission": [10.0, 10.0, 10.0]
    },
    {
      "name": "sphere-volume-cloud",
      "type": "volume",
      "color": [0.6499999761581421, 0.6499999761581421, 0.6499999761581421],
      "scattering": [0.8999999761581421, 0.8999999761581421, 0.8999999761581421]
    },
    {
      "name": "sphere-volume-glass",
      "type": "refractive",
      "color": [1.0, 0.5, 0.5],
      "trdepth": 0.019999999552965164
    },
    {
      "name": "sphere-volume-jade",
      "type": "refractive",
      "color": [0.5, 0.5, 0.5],
      "scattering": [
        0.30000001192092896, 0.6000000238418579, 0.30000001192092896
      ]
    },
    {
      "name": "sphere-volume-jade2",
      "type": "refractive",
      "color": [0.5, 0.5, 0.5],
      "scattering": [
        0.30000001192092896, 0.6000000238418579, 0.30000001192092896
      ]
    },
    {
      "name": "sphere-volume-smoke",
      "type": "volume",
      "color": [0.5, 0.5, 0.5],
      "scattering": [
        0.20000000298023224, 0.20000000298023224, 0.20000000298023224
      ]
    },
    {
      "name": "bunny-volume-cloud",
      "type": "volume",
      "color": [0.6499999761581421, 0.6499999761581421, 0.6499999761581421],
      "scattering": [0.8999999761581421, 0.8999999761581421, 0.8999999761581421]
    },
    {
      "name": "bunny-volume-glass",
      "type": "refractive",
      "color": [1.0, 0.5, 0.5],
      "trdepth": 0.019999999552965164
    },
    {
      "name": "bunny-volume-jade",
      "type": "refractive",
      "color": [0.5, 0.5, 0.5],
      "scattering": [
        0.30000001192092896, 0.6000000238418579, 0.30000001192092896
      ]
    },
    {
      "name": "bunny-volume-jade2",
      "type": "refractive",
      "color": [0.5, 0.5, 0.5],
      "roughness": 0.10000000149011612,
      "scattering": [
        0.30000001192092896, 0.6000000238418579, 0.30000001192092896
      ]
    },
    {
      "name": "bunny-volume-smoke",
      "type": "volume",
      "color": [0.5, 0.5, 0.5],
      "scattering": [
        0.20000000298023224, 0.20000000298023224, 0.20000000298023224
      ]
    }
  ],
  "shapes": [
    {
      "name": "floor",
      "uri": "shapes/floor.ply"
    },
    {
      "name": "largearealight1",
      "uri": "shapes/largearealight1.ply"
    },
    {
      "name": "largearealight2",
      "uri": "shapes/largearealight2.ply"
    },
    {
      "name": "sphere",
      "uri": "shapes/sphere.ply"
    },
    {
      "name": "bunny",
      "uri": "shapes/bunny.ply"
    }
  ],
  "instances": [
    {
      "name": "floor",
      "shape": 0,
      "material": 0
    },
    {
      "name": "largearealight1",
      "frame": [
        0.8944271802902222, -0.0, 0.4472135901451111, 0.2873478829860687,
        0.766261100769043, -0.5746957659721375, -0.3426823318004608,
        0.6425293684005737, 0.6853646636009216, -0.800000011920929,
        1.600000023841858, 1.600000023841858
      ],
      "shape": 1,
      "material": 1
    },
    {
      "name": "largearealight2",
      "frame": [
        0.8944271802902222, 0.0, -0.4472135901451111, -0.2873478829860687,
        0.766261100769043, -0.5746957659721375, 0.3426823318004608,
        0.6425293684005737, 0.6853646636009216, 0.800000011920929,
        1.600000023841858, 1.600000023841858
      ],
      "shape": 2,
      "material": 2
    },
    {
      "name": "sphere-volume-cloud",
      "frame": [
        1.0, 0.0, 0.0, 0.0, 1.0, 0.0, 0.0, 0.0, 1.0, -0.4000000059604645, 0.0,
        0.0
      ],
      "shape": 3,
      "material": 3
    },
    {
      "name": "sphere-volume-glass",
      "frame": [
        1.0, 0.0, 0.0, 0.0, 1.0, 0.0, 0.0, 0.0, 1.0, -0.20000000298023224, 0.0,
        0.0
      ],
      "shape": 3,
      "material": 4
    },
    {
      "name": "sphere-volume-jade",
      "shape": 3,
      "material": 5
    },
    {
      "name": "sphere-volume-jade2",
      "frame": [
        1.0, 0.0, 0.0, 0.0, 1.0, 0.0, 0.0, 0.0, 1.0, 0.20000000298023224, 0.0,
        0.0
      ],
      "shape": 3,
      "material": 6
    },
    {
      "name": "sphere-volume-smoke",
      "frame": [
        1.0, 0.0, 0.0, 0.0, 1.0, 0.0, 0.0, 0.0, 1.0, 0.4000000059604645, 0.0,
        0.0
      ],
      "shape": 3,
      "material": 7
    },
    {
      "name": "bunny-volume-cloud",
      "frame": [
        1.0, 0.0, 0.0, 0.0, 1.0, 0.0, 0.0, 0.0, 1.0, -0.4000000059604645, 0.0,
        -0.4000000059604645
      ],
      "shape": 4,
      "material": 8
    },
    {
      "name": "bunny-volume-glass",
      "frame": [
        1.0, 0.0, 0.0, 0.0, 1.0, 0.0, 0.0, 0.0, 1.0, -0.20000000298023224, 0.0,
        -0.4000000059604645
      ],
      "shape": 4,
      "material": 9
    },
    {
      "name": "bunny-volume-jade",
      "frame": [
        1.0, 0.0, 0.0, 0.0, 1.0, 0.0, 0.0, 0.0, 1.0, 0.0, 0.0,
        -0.4000000059604645
      ],
      "shape": 4,
      "material": 10
    },
    {
      "name": "bunny-volume-jade2",
      "frame": [
        1.0, 0.0, 0.0, 0.0, 1.0, 0.0, 0.0, 0.0, 1.0, 0.20000000298023224, 0.0,
        -0.4000000059604645
      ],
      "shape": 4,
      "material": 11
    },
    {
      "name": "bunny-volume-smoke",
      "frame": [
        1.0, 0.0, 0.0, 0.0, 1.0, 0.0, 0.0, 0.0, 1.0, 0.4000000059604645, 0.0,
        -0.4000000059604645
      ],
      "shape": 4,
      "material": 12
    }
  ]
}
