{
  "asset": {
    "copyright": "Model by Fabio Pellacini from github.com/~xelatihy/yocto-gl",
    "generator": "Yocto/GL - https://github.com/xelatihy/yocto-gl",
    "version": "4.2"
  },
  "cameras": [
    {
      "name": "default",
      "frame": [
        0.8151804208755493,
        -0.0,
        0.579207181930542,
        0.16660168766975403,
        0.9577393531799316,
        -0.23447643220424652,
        -0.5547295212745667,
        0.28763750195503235,
        0.7807304263114929,
        -0.75,
        0.4000000059604645,
        0.8999999761581421
      ],
      "aspect": 2.4000000953674316,
      "focus": 1.2168092727661133
    }
  ],
  "environments": [
    {
      "name": "sky",
      "emission": [
        0.5,
        0.5,
        0.5
      ],
      "emission_tex": 0
    }
  ],
  "textures": [
    {
      "name": "sky",
      "uri": "textures/sky.hdr"
    },
    {
      "name": "floor",
      "uri": "textures/floor.png"
    }
  ],
  "shapes": [
    {
      "name": "largearealight1",
      "uri": "shapes/largearealight1.ply"
    },
    {
      "name": "largearealight2",
      "uri": "shapes/largearealight2.ply"
    },
    {
      "name": "floor",
      "uri": "shapes/floor.ply"
    },
    {
      "name": "sphere",
      "uri": "shapes/sphere.ply"
    }
  ],
  "subdivs": [],
  "materials": [
    {
      "name": "largearealight1",
      "type": "matte",
      "emission": [
        10,
        10,
        10
      ],
      "color": [
        0,
        0,
        0
      ]
    },
    {
      "name": "largearealight2",
      "type": "matte",
      "emission": [
        10,
        10,
        10
      ],
      "color": [
        0,
        0,
        0
      ]
    },
    {
      "name": "floor",
      "type": "matte",
      "color": [
        1,
        1,
        1
      ],
      "color_tex": 1
    },
    {
      "name": "cloud",
      "type": "volume",
      "color": [
        0.5,
        0.5,
        0.5
      ],
      "roughness": 0,
      "scattering": [
        0.9,
        0.9,
        0.9
      ]
    },
    {
      "name": "redglass",
      "type": "refractive",
      "color": [
        1.0,
        0.5,
        0.5
      ],
      "roughness": 0
    },
    {
      "name": "glass",
      "type": "refractive",
      "color": [
        1.0,
        1.0,
        1.0
      ],
      "roughness": 0
    },
    {
      "name": "jade",
      "type": "refractive",
      "color": [
        0.5,
        0.5,
        0.5
      ],
      "roughness": 0,
      "scattering": [
        0.3,
        0.6,
        0.3
      ]
    },
    {
      "name": "smoke",
      "type": "volume",
      "color": [
        0.65,
        0.65,
        0.65
      ],
      "roughness": 0,
      "scattering": [
        0.2,
        0.2,
        0.2
      ]
    }
  ],
  "instances": [
    {
      "name": "largearealight1",
      "frame": [
        0.8944271802902222,
        -0.0,
        0.4472135901451111,
        0.2873478829860687,
        0.766261100769043,
        -0.5746957659721375,
        -0.3426823318004608,
        0.6425293684005737,
        0.6853646636009216,
        -0.800000011920929,
        1.600000023841858,
        1.600000023841858
      ],
      "shape": 0,
      "material": 0
    },
    {
      "name": "largearealight2",
      "frame": [
        0.8944271802902222,
        0.0,
        -0.4472135901451111,
        -0.2873478829860687,
        0.766261100769043,
        -0.5746957659721375,
        0.3426823318004608,
        0.6425293684005737,
        0.6853646636009216,
        0.800000011920929,
        1.600000023841858,
        1.600000023841858
      ],
      "shape": 1,
      "material": 1
    },
    {
      "name": "floor",
      "frame": [
        1,
        0,
        0,
        0,
        1,
        0,
        0,
        0,
        1,
        0,
        0,
        0
      ],
      "shape": 2,
      "material": 2
    },
    {
      "name": "sphere-cloud",
      "frame": [
        1,
        0,
        0,
        0,
        1,
        0,
        0,
        0,
        1,
        -0.4,
        0,
        0
      ],
      "shape": 3,
      "material": 3
    },
    {
      "name": "sphere-redglass",
      "frame": [
        1,
        0,
        0,
        0,
        1,
        0,
        0,
        0,
        1,
        -0.2,
        0,
        0
      ],
      "shape": 3,
      "material": 4
    },
    {
      "name": "sphere-glass",
      "frame": [
        1,
        0,
        0,
        0,
        1,
        0,
        0,
        0,
        1,
        0.0,
        0,
        0
      ],
      "shape": 3,
      "material": 5
    },
    {
      "name": "sphere-jade",
      "frame": [
        1,
        0,
        0,
        0,
        1,
        0,
        0,
        0,
        1,
        0.2,
        0,
        0
      ],
      "shape": 3,
      "material": 6
    },
    {
      "name": "sphere-smoke",
      "frame": [
        1,
        0,
        0,
        0,
        1,
        0,
        0,
        0,
        1,
        0.4,
        0,
        0
      ],
      "shape": 3,
      "material": 7
    }
  ]
}