{
  "asset": {
    "copyright": "Model by Fabio Pellacini from github.com/~xelatihy/yocto-gl",
    "generator": "Yocto/GL - https://github.com/xelatihy/yocto-gl",
    "version": "4.2"
  },
  "cameras": [
    {
      "name": "default",
      "frame": [1.0, 0.0, 0.0, 0.0, 1.0, 0.0, 0.0, 0.0, 1.0, 0.0, 0.0, 1.0],
      "aspect": 2.4000000953674316,
      "focus": 1.0
    }
  ],
  "environments": [
    {
      "name": "env",
      "emission": [0.5, 0.5, 0.5]
    }
  ],
  "materials": [
    {
      "name": "sphere",
      "type": "reflective",
      "color": [1.0, 1.0, 1.0],
      "roughness": 0.5
    }
  ],
  "shapes": [
    {
      "name": "sphere",
      "uri": "shapes/sphere.ply"
    }
  ],
  "instances": [
    {
      "name": "sphere",
      "frame": [
        1.0, 0.0, 0.0, 0.0, 1.0, 0.0, 0.0, 0.0, 1.0, 0.0, -0.07500000298023224,
        0.0
      ],
      "shape": 0,
      "material": 0
    }
  ]
}
